{
  "$schema": "https://json-schema.org/draft/2020-12/schema",
  "$id": "https://openbrick3d.org/schemas/1.0/coupon.schema.json",
  "title": "OpenBrick3D calibration coupon sweep",
  "description": "The calibration coupon sweep (standards/coupon-*.json, kind coupon): one cell per swept dimension with its range, step, nominal and the fit offset it calibrates. Read by openbrick-print as CouponSpec (openbrick_print::coupon_v1()); the coupon generator, openbrick calibrate record and validator rule CLUTCH.RISK use the same numbers. See docs/plan/05 section 4. A 1.0 document may use only the fields named here ($defs/knownFields).",
  "type": "object",
  "required": [
    "openbrick",
    "kind",
    "version",
    "license",
    "credit",
    "source",
    "copies",
    "label",
    "cells"
  ],
  "properties": {
    "openbrick": {
      "$ref": "#/$defs/pragma"
    },
    "kind": {
      "const": "coupon"
    },
    "version": {
      "description": "Coupon layout version, written into a fit profile as calibration.couponVersion. A changed sweep is a new version and a new file.",
      "type": "integer",
      "minimum": 1,
      "maximum": 4294967295
    },
    "license": {
      "$ref": "#/$defs/spdx"
    },
    "credit": {
      "$ref": "#/$defs/credit"
    },
    "provenance": {
      "$ref": "#/$defs/provenance"
    },
    "notes": {
      "description": "Free text. Not read by openbrick-print.",
      "type": "string"
    },
    "source": {
      "description": "Where the layout numbers (copies, label) come from. Required: every geometry number cites its source (CLAUDE.md).",
      "type": "string",
      "minLength": 1
    },
    "copies": {
      "description": "How many identical rows of every sweep the coupon prints, for repeatability.",
      "type": "integer",
      "minimum": 1,
      "maximum": 16
    },
    "label": {
      "description": "The embossed label on each cell.",
      "type": "object",
      "required": [
        "reliefMm",
        "strokeMm"
      ],
      "properties": {
        "reliefMm": {
          "description": "Relief height of the label in millimetres.",
          "$ref": "#/$defs/positiveMm"
        },
        "strokeMm": {
          "description": "Stroke width of the label in millimetres.",
          "$ref": "#/$defs/positiveMm"
        }
      }
    },
    "cells": {
      "description": "The sweeps, in the order the coupon prints them. Ids must be unique, every standardId must name a row of the Dimensional Standard with a nominal, and endMm must lie a whole number of steps after startMm; JSON Schema cannot say so, so openbrick-print checks it when it loads the file (CouponSpec::check), and cargo xtask data runs that check.",
      "type": "array",
      "minItems": 1,
      "items": {
        "$ref": "#/$defs/cell"
      }
    }
  },
  "if": {
    "$ref": "#/$defs/atThisMinor"
  },
  "then": {
    "$ref": "#/$defs/knownFields"
  },
  "$defs": {
    "knownFields": {
      "description": "The fields schema 1.0 names, object by object; true means the value is checked by the main schema. Applied only to 1.0 documents (see atThisMinor), where any other field is an error: serde would drop it silently, so a misspelt optional field would change nothing. Objects not listed here are open on purpose. cargo xtask data checks that these lists match the properties the schema declares.",
      "properties": {
        "openbrick": true,
        "kind": true,
        "version": true,
        "license": true,
        "credit": {
          "properties": {
            "author": true,
            "url": true
          },
          "additionalProperties": false
        },
        "provenance": {
          "properties": {
            "source": true,
            "author": true,
            "license": true,
            "url": true,
            "modified": true,
            "history": true
          },
          "additionalProperties": false
        },
        "notes": true,
        "source": true,
        "copies": true,
        "label": {
          "properties": {
            "reliefMm": true,
            "strokeMm": true
          },
          "additionalProperties": false
        },
        "cells": {
          "items": {
            "properties": {
              "id": true,
              "label": true,
              "row": true,
              "standardId": true,
              "startMm": true,
              "endMm": true,
              "stepMm": true,
              "offsetField": true,
              "source": true
            },
            "additionalProperties": false
          }
        }
      },
      "additionalProperties": false
    },
    "atThisMinor": {
      "description": "Matches a document whose pragma names this schema's minor version, 1.0 (or a 1.0.x patch). Such a document may use only the fields this schema names ($defs/knownFields). A document of a later 1.x minor may carry fields added since; this schema checks the fields it knows and ignores the rest, so older tools can still read newer minors (docs/plan/08 section 9).",
      "required": [
        "openbrick"
      ],
      "properties": {
        "openbrick": {
          "type": "string",
          "pattern": "^1\\.0(\\.|$)"
        }
      }
    },
    "cell": {
      "description": "One swept dimension (openbrick_print::CouponCell). Its values are startMm + i x stepMm for every whole i up to endMm; the chosen value minus the nominal of standardId is the fit offset named by offsetField.",
      "type": "object",
      "required": [
        "id",
        "label",
        "row",
        "standardId",
        "startMm",
        "endMm",
        "stepMm",
        "offsetField",
        "source"
      ],
      "properties": {
        "id": {
          "description": "Cell id: the key of calibration.chosenCells in a fit profile and of required_cells() (stud, tube, pocketTubeOD, ...).",
          "type": "string",
          "pattern": "^[a-z][A-Za-z0-9]*$"
        },
        "label": {
          "description": "What the cell sweeps, for people.",
          "type": "string",
          "minLength": 1
        },
        "row": {
          "description": "Coupon row the cell is printed in; cells that share a row are printed together.",
          "type": "string",
          "pattern": "^[a-z][A-Za-z0-9]*$"
        },
        "standardId": {
          "description": "Id of the row of standards/dimensions-v1.json that gives the nominal.",
          "type": "string",
          "pattern": "^[a-z][a-z0-9_]*$"
        },
        "startMm": {
          "description": "First value of the sweep in millimetres.",
          "$ref": "#/$defs/positiveMm"
        },
        "endMm": {
          "description": "Last value of the sweep in millimetres, a whole number of steps after startMm.",
          "$ref": "#/$defs/positiveMm"
        },
        "stepMm": {
          "description": "Step between neighbouring cells in millimetres.",
          "$ref": "#/$defs/positiveMm"
        },
        "offsetField": {
          "description": "The offsetsMm field of a fit profile this cell calibrates, or null for a row printed for reference only (openbrick calibrate record refuses it).",
          "enum": [
            "studDiameter",
            "tubeInnerDiameter",
            "tubeOuterDiameter",
            "ribDepth",
            "pinDiameter",
            "horizontalHoleDiameter",
            "axleHole",
            "barDiameter",
            "clipOpening",
            null
          ]
        },
        "source": {
          "description": "Where the sweep comes from. Required: every geometry number cites its source (CLAUDE.md).",
          "type": "string",
          "minLength": 1
        }
      }
    },
    "positiveMm": {
      "description": "A length in millimetres greater than zero.",
      "type": "number",
      "exclusiveMinimum": 0
    },
    "pragma": {
      "description": "Schema version pragma: major 1 and a minor, optionally a patch (docs/plan/08 sections 1 and 9). Every 1.x is accepted: readers ignore fields from minors newer than they know, and this schema checks only the fields it names in documents newer than 1.0 (see atThisMinor).",
      "type": "string",
      "pattern": "^1\\.(0|[1-9][0-9]*)(\\.(0|[1-9][0-9]*))?$"
    },
    "spdx": {
      "description": "An SPDX licence id, or a simple AND, OR or WITH expression of ids (LICENSE-POLICY.md).",
      "type": "string",
      "pattern": "^[A-Za-z0-9][A-Za-z0-9.+-]*( (AND|OR|WITH) [A-Za-z0-9][A-Za-z0-9.+-]*)*$"
    },
    "credit": {
      "description": "Who made the document. Keeping it is a community norm, not a legal condition (LICENSE-POLICY.md).",
      "type": "object",
      "required": [
        "author"
      ],
      "properties": {
        "author": {
          "type": "string",
          "minLength": 1
        },
        "url": {
          "type": "string",
          "pattern": "^https?://\\S+$"
        }
      }
    },
    "provenance": {
      "description": "Where the data came from, so attribution travels with it through conversion, export and printing (LICENSE-POLICY.md, docs/plan/06 section 2).",
      "type": "object",
      "properties": {
        "source": {
          "description": "original, or the upstream file or project the data derives from.",
          "type": "string"
        },
        "author": {
          "type": "string"
        },
        "license": {
          "$ref": "#/$defs/spdx"
        },
        "url": {
          "type": "string",
          "pattern": "^https?://\\S+$"
        },
        "modified": {
          "type": "boolean"
        },
        "history": {
          "type": "array",
          "items": {
            "type": "string"
          }
        }
      }
    }
  }
}
