{
  "openbrick": "1.0",
  "kind": "coupon",
  "version": 1,
  "license": "CC0-1.0",
  "credit": { "author": "OpenBrick3D contributors", "url": "https://github.com/NeuralDEEPnet/openBrick" },
  "notes": "The calibration coupon sweep, version 1 (calibration.couponVersion in a fit profile). One cell per sweep: values run from startMm to endMm in steps of stepMm, and a fit offset is the chosen value minus the nominal of standardId in standards/dimensions-v1.json. Cells that share a row are printed in one row: the pocket row crosses tube outer diameter with rib depth (the pocket set of the coupon chooses which pairs: by default the nominal row and column of the cross, every pair in the full set; openbrick_print::CouponSpec::printed_pockets), and the bar and clip row holds both sweeps. Read by openbrick_print::coupon_v1(); the coupon generator, openbrick calibrate record and rule CLUTCH.RISK all use these numbers.",
  "source": "docs/plan/05 section 4: the coupon has two identical rows of every sweep (repeatability), and each cell has an embossed label (relief 0.6 mm, stroke 0.8 mm). The sweep of each cell cites its own source.",
  "copies": 2,
  "label": { "reliefMm": 0.6, "strokeMm": 0.8 },
  "cells": [
    {
      "id": "stud",
      "label": "Studs (male), outer diameter",
      "row": "stud",
      "standardId": "stud_diameter",
      "startMm": 4.60,
      "endMm": 4.95,
      "stepMm": 0.05,
      "offsetField": "studDiameter",
      "source": "docs/plan/05 section 4, row Studs (male): OD 4.60 to 4.95 mm, step 0.05 mm; standards/dimensions-v1.json stud_diameter print_target fdm-0.4: coupon sweeps 4.60 to 4.95"
    },
    {
      "id": "tube",
      "label": "Tube bores (female, vertical), inner diameter",
      "row": "tube",
      "standardId": "tube_inner_diameter",
      "startMm": 4.80,
      "endMm": 5.05,
      "stepMm": 0.05,
      "offsetField": "tubeInnerDiameter",
      "source": "docs/plan/05 section 4, row Tube bores: ID 4.80 to 5.05 mm, step 0.05 mm (standards/dimensions-v1.json tube_inner_diameter print_target fdm-0.4: 4.90 to 5.00 printed, inside the sweep)"
    },
    {
      "id": "pocketTubeOD",
      "label": "2x2 pockets, tube outer diameter",
      "row": "pocket",
      "standardId": "tube_outer_diameter",
      "startMm": 6.40,
      "endMm": 6.65,
      "stepMm": 0.05,
      "offsetField": "tubeOuterDiameter",
      "source": "docs/plan/05 section 4, row 2x2 pockets: tube OD 6.40 to 6.65 mm, step 0.05 mm; standards/dimensions-v1.json tube_outer_diameter print_target fdm-0.4: 6.40 to 6.65 by coupon pocket row"
    },
    {
      "id": "pocketRib",
      "label": "2x2 pockets, wall rib depth",
      "row": "pocket",
      "standardId": "rib_depth",
      "startMm": 0.20,
      "endMm": 0.50,
      "stepMm": 0.05,
      "offsetField": "ribDepth",
      "source": "docs/plan/05 section 4, row 2x2 pockets: rib depth 0.2 to 0.5 mm, step 0.05 mm; standards/dimensions-v1.json rib_depth print_target fdm-0.4: 0.2 to 0.5 by coupon pocket row"
    },
    {
      "id": "technicH",
      "label": "Horizontal Technic holes, inner diameter",
      "row": "technicH",
      "standardId": "technic_hole_diameter",
      "startMm": 4.80,
      "endMm": 5.10,
      "stepMm": 0.05,
      "offsetField": "horizontalHoleDiameter",
      "source": "docs/plan/05 section 4, row Horizontal Technic holes: ID 4.80 to 5.10 mm, step 0.05 mm (standards/dimensions-v1.json technic_hole_diameter print_target fdm-0.4: horizontal about +0.2, inside the sweep)"
    },
    {
      "id": "pin",
      "label": "Technic pins (male), outer diameter",
      "row": "pin",
      "standardId": "pin_shaft_diameter",
      "startMm": 4.65,
      "endMm": 4.90,
      "stepMm": 0.05,
      "offsetField": "pinDiameter",
      "source": "docs/plan/05 section 4, row Technic pins (male): OD 4.65 to 4.90 mm, step 0.05 mm; standards/dimensions-v1.json pin_shaft_diameter print_target fdm-0.4: 4.65 to 4.90 by coupon"
    },
    {
      "id": "axleTips",
      "label": "Axles (male), across tips",
      "row": "axleTips",
      "standardId": "axle_across_tips",
      "startMm": 4.60,
      "endMm": 4.85,
      "stepMm": 0.05,
      "offsetField": null,
      "source": "docs/plan/05 section 4, row Axles (male): across tips 4.60 to 4.85 mm, step 0.05 mm; standards/dimensions-v1.json axle_across_tips print_target fdm-0.4: 4.60 to 4.85 by coupon. No fit offset takes this row yet (the fit profile has axleHole only), so it is printed for reference and not recorded."
    },
    {
      "id": "axle",
      "label": "Axle holes, cross envelope",
      "row": "axle",
      "standardId": "axle_across_tips",
      "startMm": 4.75,
      "endMm": 5.00,
      "stepMm": 0.05,
      "offsetField": "axleHole",
      "source": "docs/plan/05 section 4, row Axle holes: envelope 4.75 to 5.00 mm, step 0.05 mm; the nominal hole envelope is the axle across tips (standards/dimensions-v1.json axle_across_tips, 4.80), as the section 3 example implies (axle 4.85 with axleHole +0.05)"
    },
    {
      "id": "bar",
      "label": "Bars, diameter",
      "row": "barClip",
      "standardId": "bar_diameter",
      "startMm": 3.14,
      "endMm": 3.26,
      "stepMm": 0.04,
      "offsetField": "barDiameter",
      "source": "docs/plan/05 section 4, row Bar and clip pair: bar 3.14 to 3.26 mm, step 0.04 mm; standards/dimensions-v1.json bar_diameter print_target fdm-0.4: 3.14 to 3.26 by coupon"
    },
    {
      "id": "clip",
      "label": "Clips, opening",
      "row": "barClip",
      "standardId": "hollow_stud_bore",
      "startMm": 3.14,
      "endMm": 3.30,
      "stepMm": 0.04,
      "offsetField": "clipOpening",
      "source": "docs/plan/05 section 4, row Bar and clip pair: clip 3.14 to 3.30 mm, step 0.04 mm; standards/dimensions-v1.json hollow_stud_bore (hollow stud bore / clip opening) print_target fdm-0.4: 3.14 to 3.30 by coupon"
    }
  ]
}
